{
  "loop_id": "loop-mskyoaqe-e4a0e0",
  "status": "initialized",
  "phase": "planning",
  "iteration": 0,
  "active_task": null,
  "active_agent": null,
  "last_successful_checkpoint": null,
  "current_score": 0,
  "baseline_score": 0,
  "target_score": 80,
  "retry_count": 0,
  "failure_signatures": [],
  "blocked_reason": null,
  "pending_approval": null,
  "started_at": "2026-08-08T22:44:39.647Z",
  "updated_at": "2026-08-08T22:44:39.647Z",
  "completed_at": null
}
