{
  "loop_id": "loop-mrgp6m54-2963ab",
  "status": "initialized",
  "phase": "planning",
  "iteration": 0,
  "active_task": null,
  "active_agent": null,
  "last_successful_checkpoint": "cp-mrgr2kng-c5335f",
  "current_score": 0,
  "baseline_score": 0,
  "target_score": 80,
  "retry_count": 0,
  "failure_signatures": [],
  "blocked_reason": null,
  "pending_approval": null,
  "started_at": "2026-07-11T18:28:11.054Z",
  "updated_at": "2026-07-11T18:28:11.054Z",
  "completed_at": null
}
