{
  "loop_id": "loop-msd76hlt-0b425f",
  "status": "completed",
  "phase": "execution",
  "iteration": 1,
  "active_task": null,
  "active_agent": "implementer",
  "last_successful_checkpoint": null,
  "current_score": 100,
  "baseline_score": 100,
  "target_score": 80,
  "retry_count": 0,
  "failure_signatures": [],
  "blocked_reason": null,
  "pending_approval": null,
  "started_at": "2026-08-03T12:20:35.909Z",
  "updated_at": "2026-08-03T12:55:40.478Z",
  "completed_at": "2026-08-03T12:55:40.478Z"
}
